<?xml version="1.0"?>
<?xml-stylesheet type="text/xsl" href="pdml2html.xsl"?>
<!-- You can find pdml2html.xsl in /home/kawamuray/libvirt-wireshark-dissector/local/share/wireshark or at http://anonsvn.wireshark.org/trunk/wireshark/pdml2html.xsl. -->
<pdml version="0" creator="wireshark/1.11.0" time="Mon Jun 17 21:35:53 2013" capture_file="">
<packet>
  <proto name="geninfo" pos="0" showname="General information" size="94">
    <field name="num" pos="0" show="4" showname="Number" value="4" size="94"/>
    <field name="len" pos="0" show="94" showname="Frame Length" value="5e" size="94"/>
    <field name="caplen" pos="0" show="94" showname="Captured Length" value="5e" size="94"/>
    <field name="timestamp" pos="0" show="Jun 17, 2013 21:35:54.848792000 JST" showname="Captured Time" value="1371472554.848792000" size="94"/>
  </proto>
  <proto name="frame" showname="Frame 4: 94 bytes on wire (752 bits), 94 bytes captured (752 bits) on interface 0" size="94" pos="0">
    <field name="frame.interface_id" showname="Interface id: 0" size="0" pos="0" show="0"/>
    <field name="frame.encap_type" showname="Encapsulation type: Ethernet (1)" size="0" pos="0" show="1"/>
    <field name="frame.time" showname="Arrival Time: Jun 17, 2013 21:35:54.848792000 JST" size="0" pos="0" show="Jun 17, 2013 21:35:54.848792000"/>
    <field name="frame.offset_shift" showname="Time shift for this packet: 0.000000000 seconds" size="0" pos="0" show="0.000000000"/>
    <field name="frame.time_epoch" showname="Epoch Time: 1371472554.848792000 seconds" size="0" pos="0" show="1371472554.848792000"/>
    <field name="frame.time_delta" showname="Time delta from previous captured frame: 0.000187000 seconds" size="0" pos="0" show="0.000187000"/>
    <field name="frame.time_delta_displayed" showname="Time delta from previous displayed frame: 0.000000000 seconds" size="0" pos="0" show="0.000000000"/>
    <field name="frame.time_relative" showname="Time since reference or first frame: 0.000210000 seconds" size="0" pos="0" show="0.000210000"/>
    <field name="frame.number" showname="Frame Number: 4" size="0" pos="0" show="4"/>
    <field name="frame.len" showname="Frame Length: 94 bytes (752 bits)" size="0" pos="0" show="94"/>
    <field name="frame.cap_len" showname="Capture Length: 94 bytes (752 bits)" size="0" pos="0" show="94"/>
    <field name="frame.marked" showname="Frame is marked: False" size="0" pos="0" show="0"/>
    <field name="frame.ignored" showname="Frame is ignored: False" size="0" pos="0" show="0"/>
    <field name="frame.protocols" showname="Protocols in frame: eth:ip:tcp:libvirt" size="0" pos="0" show="eth:ip:tcp:libvirt"/>
  </proto>
  <proto name="eth" showname="Ethernet II, Src: 00:00:00_00:00:00 (00:00:00:00:00:00), Dst: 00:00:00_00:00:00 (00:00:00:00:00:00)" size="14" pos="0">
    <field name="eth.dst" showname="Destination: 00:00:00_00:00:00 (00:00:00:00:00:00)" size="6" pos="0" show="00:00:00:00:00:00" value="000000000000">
      <field name="eth.addr" showname="Address: 00:00:00_00:00:00 (00:00:00:00:00:00)" size="6" pos="0" show="00:00:00:00:00:00" value="000000000000"/>
      <field name="eth.lg" showname=".... ..0. .... .... .... .... = LG bit: Globally unique address (factory default)" size="3" pos="0" show="0" value="0" unmaskedvalue="000000"/>
      <field name="eth.ig" showname=".... ...0 .... .... .... .... = IG bit: Individual address (unicast)" size="3" pos="0" show="0" value="0" unmaskedvalue="000000"/>
    </field>
    <field name="eth.src" showname="Source: 00:00:00_00:00:00 (00:00:00:00:00:00)" size="6" pos="6" show="00:00:00:00:00:00" value="000000000000">
      <field name="eth.addr" showname="Address: 00:00:00_00:00:00 (00:00:00:00:00:00)" size="6" pos="6" show="00:00:00:00:00:00" value="000000000000"/>
      <field name="eth.lg" showname=".... ..0. .... .... .... .... = LG bit: Globally unique address (factory default)" size="3" pos="6" show="0" value="0" unmaskedvalue="000000"/>
      <field name="eth.ig" showname=".... ...0 .... .... .... .... = IG bit: Individual address (unicast)" size="3" pos="6" show="0" value="0" unmaskedvalue="000000"/>
    </field>
    <field name="eth.type" showname="Type: IP (0x0800)" size="2" pos="12" show="0x0800" value="0800"/>
  </proto>
  <proto name="ip" showname="Internet Protocol Version 4, Src: 127.0.0.1 (127.0.0.1), Dst: 127.0.0.1 (127.0.0.1)" size="20" pos="14">
    <field name="ip.version" showname="Version: 4" size="1" pos="14" show="4" value="45"/>
    <field name="ip.hdr_len" showname="Header length: 20 bytes" size="1" pos="14" show="20" value="45"/>
    <field name="ip.dsfield" showname="Differentiated Services Field: 0x00 (DSCP 0x00: Default; ECN: 0x00: Not-ECT (Not ECN-Capable Transport))" size="1" pos="15" show="0" value="00">
      <field name="ip.dsfield.dscp" showname="0000 00.. = Differentiated Services Codepoint: Default (0x00)" size="1" pos="15" show="0x00" value="0" unmaskedvalue="00"/>
      <field name="ip.dsfield.ecn" showname=".... ..00 = Explicit Congestion Notification: Not-ECT (Not ECN-Capable Transport) (0x00)" size="1" pos="15" show="0x00" value="0" unmaskedvalue="00"/>
    </field>
    <field name="ip.len" showname="Total Length: 80" size="2" pos="16" show="80" value="0050"/>
    <field name="ip.id" showname="Identification: 0xba6a (47722)" size="2" pos="18" show="0xba6a" value="ba6a"/>
    <field name="ip.flags" showname="Flags: 0x02 (Don&apos;t Fragment)" size="1" pos="20" show="0x02" value="40">
      <field name="ip.flags.rb" showname="0... .... = Reserved bit: Not set" size="1" pos="20" show="0" value="40"/>
      <field name="ip.flags.df" showname=".1.. .... = Don&apos;t fragment: Set" size="1" pos="20" show="1" value="40"/>
      <field name="ip.flags.mf" showname="..0. .... = More fragments: Not set" size="1" pos="20" show="0" value="40"/>
    </field>
    <field name="ip.frag_offset" showname="Fragment offset: 0" size="2" pos="20" show="0" value="4000"/>
    <field name="ip.ttl" showname="Time to live: 64" size="1" pos="22" show="64" value="40"/>
    <field name="ip.proto" showname="Protocol: TCP (6)" size="1" pos="23" show="6" value="06"/>
    <field name="ip.checksum" showname="Header checksum: 0x823b [correct]" size="2" pos="24" show="0x823b" value="823b">
      <field name="ip.checksum_good" showname="Good: True" size="2" pos="24" show="1" value="823b"/>
      <field name="ip.checksum_bad" showname="Bad: False" size="2" pos="24" show="0" value="823b"/>
    </field>
    <field name="ip.src" showname="Source: 127.0.0.1 (127.0.0.1)" size="4" pos="26" show="127.0.0.1" value="7f000001"/>
    <field name="ip.addr" showname="Source or Destination Address: 127.0.0.1 (127.0.0.1)" hide="yes" size="4" pos="26" show="127.0.0.1" value="7f000001"/>
    <field name="ip.src_host" showname="Source Host: 127.0.0.1" hide="yes" size="4" pos="26" show="127.0.0.1" value="7f000001"/>
    <field name="ip.host" showname="Source or Destination Host: 127.0.0.1" hide="yes" size="4" pos="26" show="127.0.0.1" value="7f000001"/>
    <field name="ip.dst" showname="Destination: 127.0.0.1 (127.0.0.1)" size="4" pos="30" show="127.0.0.1" value="7f000001"/>
    <field name="ip.addr" showname="Source or Destination Address: 127.0.0.1 (127.0.0.1)" hide="yes" size="4" pos="30" show="127.0.0.1" value="7f000001"/>
    <field name="ip.dst_host" showname="Destination Host: 127.0.0.1" hide="yes" size="4" pos="30" show="127.0.0.1" value="7f000001"/>
    <field name="ip.host" showname="Source or Destination Host: 127.0.0.1" hide="yes" size="4" pos="30" show="127.0.0.1" value="7f000001"/>
    <field name="" show="Source GeoIP: Unknown" size="4" pos="26" value="7f000001"/>
    <field name="" show="Destination GeoIP: Unknown" size="4" pos="30" value="7f000001"/>
  </proto>
  <proto name="tcp" showname="Transmission Control Protocol, Src Port: 48144 (48144), Dst Port: 16509 (16509), Seq: 1, Ack: 1, Len: 28" size="32" pos="34">
    <field name="tcp.srcport" showname="Source port: 48144 (48144)" size="2" pos="34" show="48144" value="bc10"/>
    <field name="tcp.dstport" showname="Destination port: 16509 (16509)" size="2" pos="36" show="16509" value="407d"/>
    <field name="tcp.port" showname="Source or Destination Port: 48144" hide="yes" size="2" pos="34" show="48144" value="bc10"/>
    <field name="tcp.port" showname="Source or Destination Port: 16509" hide="yes" size="2" pos="36" show="16509" value="407d"/>
    <field name="tcp.stream" showname="Stream index: 0" size="0" pos="34" show="0"/>
    <field name="tcp.len" showname="TCP Segment Len: 28" hide="yes" size="1" pos="46" show="28" value="80"/>
    <field name="tcp.seq" showname="Sequence number: 1    (relative sequence number)" size="4" pos="38" show="1" value="9d57d388"/>
    <field name="tcp.nxtseq" showname="Next sequence number: 29    (relative sequence number)" size="0" pos="34" show="29"/>
    <field name="tcp.ack" showname="Acknowledgment number: 1    (relative ack number)" size="4" pos="42" show="1" value="8047d278"/>
    <field name="tcp.hdr_len" showname="Header length: 32 bytes" size="1" pos="46" show="32" value="80"/>
    <field name="tcp.flags" showname="Flags: 0x018 (PSH, ACK)" size="2" pos="46" show="0x0018" value="18" unmaskedvalue="8018">
      <field name="tcp.flags.res" showname="000. .... .... = Reserved: Not set" size="1" pos="46" show="0" value="0" unmaskedvalue="80"/>
      <field name="tcp.flags.ns" showname="...0 .... .... = Nonce: Not set" size="1" pos="46" show="0" value="0" unmaskedvalue="80"/>
      <field name="tcp.flags.cwr" showname=".... 0... .... = Congestion Window Reduced (CWR): Not set" size="1" pos="47" show="0" value="0" unmaskedvalue="18"/>
      <field name="tcp.flags.ecn" showname=".... .0.. .... = ECN-Echo: Not set" size="1" pos="47" show="0" value="0" unmaskedvalue="18"/>
      <field name="tcp.flags.urg" showname=".... ..0. .... = Urgent: Not set" size="1" pos="47" show="0" value="0" unmaskedvalue="18"/>
      <field name="tcp.flags.ack" showname=".... ...1 .... = Acknowledgment: Set" size="1" pos="47" show="1" value="1" unmaskedvalue="18"/>
      <field name="tcp.flags.push" showname=".... .... 1... = Push: Set" size="1" pos="47" show="1" value="1" unmaskedvalue="18"/>
      <field name="tcp.flags.reset" showname=".... .... .0.. = Reset: Not set" size="1" pos="47" show="0" value="0" unmaskedvalue="18"/>
      <field name="tcp.flags.syn" showname=".... .... ..0. = Syn: Not set" size="1" pos="47" show="0" value="0" unmaskedvalue="18"/>
      <field name="tcp.flags.fin" showname=".... .... ...0 = Fin: Not set" size="1" pos="47" show="0" value="0" unmaskedvalue="18"/>
    </field>
    <field name="tcp.window_size_value" showname="Window size value: 342" size="2" pos="48" show="342" value="0156"/>
    <field name="tcp.window_size" showname="Calculated window size: 43776" size="2" pos="48" show="43776" value="0156"/>
    <field name="tcp.window_size_scalefactor" showname="Window size scaling factor: 128" size="2" pos="48" show="128" value="0156"/>
    <field name="tcp.checksum" showname="Checksum: 0xfe44 [validation disabled]" size="2" pos="50" show="0xfe44" value="fe44">
      <field name="tcp.checksum_good" showname="Good Checksum: False" size="2" pos="50" show="0" value="fe44"/>
      <field name="tcp.checksum_bad" showname="Bad Checksum: False" size="2" pos="50" show="0" value="fe44"/>
    </field>
    <field name="tcp.options" showname="Options: (12 bytes), No-Operation (NOP), No-Operation (NOP), Timestamps" size="12" pos="54" show="01:01:08:0a:07:44:69:ef:07:44:69:ef" value="0101080a074469ef074469ef">
      <field name="" show="No-Operation (NOP)" size="1" pos="54" value="01">
        <field name="ip.opt.type" showname="Type: 1" size="1" pos="54" show="1" value="01">
          <field name="ip.opt.type.copy" showname="0... .... = Copy on fragmentation: No" size="1" pos="54" show="0" value="0" unmaskedvalue="01"/>
          <field name="ip.opt.type.class" showname=".00. .... = Class: Control (0)" size="1" pos="54" show="0" value="0" unmaskedvalue="01"/>
          <field name="ip.opt.type.number" showname="...0 0001 = Number: No-Operation (NOP) (1)" size="1" pos="54" show="1" value="1" unmaskedvalue="01"/>
        </field>
      </field>
      <field name="" show="No-Operation (NOP)" size="1" pos="55" value="01">
        <field name="ip.opt.type" showname="Type: 1" size="1" pos="55" show="1" value="01">
          <field name="ip.opt.type.copy" showname="0... .... = Copy on fragmentation: No" size="1" pos="55" show="0" value="0" unmaskedvalue="01"/>
          <field name="ip.opt.type.class" showname=".00. .... = Class: Control (0)" size="1" pos="55" show="0" value="0" unmaskedvalue="01"/>
          <field name="ip.opt.type.number" showname="...0 0001 = Number: No-Operation (NOP) (1)" size="1" pos="55" show="1" value="1" unmaskedvalue="01"/>
        </field>
      </field>
      <field name="" show="Timestamps: TSval 121924079, TSecr 121924079" size="10" pos="56" value="080a074469ef074469ef">
        <field name="tcp.option_kind" showname="Kind: Timestamp (8)" size="1" pos="56" show="8" value="08"/>
        <field name="tcp.option_len" showname="Length: 10" size="1" pos="57" show="10" value="0a"/>
        <field name="tcp.options.timestamp.tsval" showname="Timestamp value: 121924079" size="4" pos="58" show="121924079" value="074469ef"/>
        <field name="tcp.options.timestamp.tsecr" showname="Timestamp echo reply: 121924079" size="4" pos="62" show="121924079" value="074469ef"/>
      </field>
    </field>
    <field name="tcp.analysis" showname="SEQ/ACK analysis" size="0" pos="34" show="" value="">
      <field name="tcp.analysis.bytes_in_flight" showname="Bytes in flight: 28" size="0" pos="34" show="28"/>
    </field>
    <field name="tcp.pdu.size" showname="PDU Size: 28" size="28" pos="66" show="28" value="0000001c200080860000000100000042000000000000000000000000"/>
  </proto>
  <proto name="libvirt" showname="Libvirt" size="28" pos="66">
    <field name="libvirt.length" showname="length: 28" size="4" pos="66" show="28" value="0000001c"/>
    <field name="libvirt.program" showname="program: REMOTE (0x20008086)" size="4" pos="70" show="0x20008086" value="20008086"/>
    <field name="libvirt.version" showname="version: 1" size="4" pos="74" show="1" value="00000001"/>
    <field name="libvirt.procedure" showname="procedure: AUTH_LIST (66)" size="4" pos="78" show="66" value="00000042"/>
    <field name="libvirt.type" showname="type: CALL (0)" size="4" pos="82" show="0" value="00000000"/>
    <field name="libvirt.serial" showname="serial: 0" size="4" pos="86" show="0" value="00000000"/>
    <field name="libvirt.status" showname="status: OK (0)" size="4" pos="90" show="0" value="00000000"/>
  </proto>
</packet>


<packet>
  <proto name="geninfo" pos="0" showname="General information" size="102">
    <field name="num" pos="0" show="6" showname="Number" value="6" size="102"/>
    <field name="len" pos="0" show="102" showname="Frame Length" value="66" size="102"/>
    <field name="caplen" pos="0" show="102" showname="Captured Length" value="66" size="102"/>
    <field name="timestamp" pos="0" show="Jun 17, 2013 21:35:54.853564000 JST" showname="Captured Time" value="1371472554.853564000" size="102"/>
  </proto>
  <proto name="frame" showname="Frame 6: 102 bytes on wire (816 bits), 102 bytes captured (816 bits) on interface 0" size="102" pos="0">
    <field name="frame.interface_id" showname="Interface id: 0" size="0" pos="0" show="0"/>
    <field name="frame.encap_type" showname="Encapsulation type: Ethernet (1)" size="0" pos="0" show="1"/>
    <field name="frame.time" showname="Arrival Time: Jun 17, 2013 21:35:54.853564000 JST" size="0" pos="0" show="Jun 17, 2013 21:35:54.853564000"/>
    <field name="frame.offset_shift" showname="Time shift for this packet: 0.000000000 seconds" size="0" pos="0" show="0.000000000"/>
    <field name="frame.time_epoch" showname="Epoch Time: 1371472554.853564000 seconds" size="0" pos="0" show="1371472554.853564000"/>
    <field name="frame.time_delta" showname="Time delta from previous captured frame: 0.004765000 seconds" size="0" pos="0" show="0.004765000"/>
    <field name="frame.time_delta_displayed" showname="Time delta from previous displayed frame: 0.004772000 seconds" size="0" pos="0" show="0.004772000"/>
    <field name="frame.time_relative" showname="Time since reference or first frame: 0.004982000 seconds" size="0" pos="0" show="0.004982000"/>
    <field name="frame.number" showname="Frame Number: 6" size="0" pos="0" show="6"/>
    <field name="frame.len" showname="Frame Length: 102 bytes (816 bits)" size="0" pos="0" show="102"/>
    <field name="frame.cap_len" showname="Capture Length: 102 bytes (816 bits)" size="0" pos="0" show="102"/>
    <field name="frame.marked" showname="Frame is marked: False" size="0" pos="0" show="0"/>
    <field name="frame.ignored" showname="Frame is ignored: False" size="0" pos="0" show="0"/>
    <field name="frame.protocols" showname="Protocols in frame: eth:ip:tcp:libvirt" size="0" pos="0" show="eth:ip:tcp:libvirt"/>
  </proto>
  <proto name="eth" showname="Ethernet II, Src: 00:00:00_00:00:00 (00:00:00:00:00:00), Dst: 00:00:00_00:00:00 (00:00:00:00:00:00)" size="14" pos="0">
    <field name="eth.dst" showname="Destination: 00:00:00_00:00:00 (00:00:00:00:00:00)" size="6" pos="0" show="00:00:00:00:00:00" value="000000000000">
      <field name="eth.addr" showname="Address: 00:00:00_00:00:00 (00:00:00:00:00:00)" size="6" pos="0" show="00:00:00:00:00:00" value="000000000000"/>
      <field name="eth.lg" showname=".... ..0. .... .... .... .... = LG bit: Globally unique address (factory default)" size="3" pos="0" show="0" value="0" unmaskedvalue="000000"/>
      <field name="eth.ig" showname=".... ...0 .... .... .... .... = IG bit: Individual address (unicast)" size="3" pos="0" show="0" value="0" unmaskedvalue="000000"/>
    </field>
    <field name="eth.src" showname="Source: 00:00:00_00:00:00 (00:00:00:00:00:00)" size="6" pos="6" show="00:00:00:00:00:00" value="000000000000">
      <field name="eth.addr" showname="Address: 00:00:00_00:00:00 (00:00:00:00:00:00)" size="6" pos="6" show="00:00:00:00:00:00" value="000000000000"/>
      <field name="eth.lg" showname=".... ..0. .... .... .... .... = LG bit: Globally unique address (factory default)" size="3" pos="6" show="0" value="0" unmaskedvalue="000000"/>
      <field name="eth.ig" showname=".... ...0 .... .... .... .... = IG bit: Individual address (unicast)" size="3" pos="6" show="0" value="0" unmaskedvalue="000000"/>
    </field>
    <field name="eth.type" showname="Type: IP (0x0800)" size="2" pos="12" show="0x0800" value="0800"/>
  </proto>
  <proto name="ip" showname="Internet Protocol Version 4, Src: 127.0.0.1 (127.0.0.1), Dst: 127.0.0.1 (127.0.0.1)" size="20" pos="14">
    <field name="ip.version" showname="Version: 4" size="1" pos="14" show="4" value="45"/>
    <field name="ip.hdr_len" showname="Header length: 20 bytes" size="1" pos="14" show="20" value="45"/>
    <field name="ip.dsfield" showname="Differentiated Services Field: 0x00 (DSCP 0x00: Default; ECN: 0x00: Not-ECT (Not ECN-Capable Transport))" size="1" pos="15" show="0" value="00">
      <field name="ip.dsfield.dscp" showname="0000 00.. = Differentiated Services Codepoint: Default (0x00)" size="1" pos="15" show="0x00" value="0" unmaskedvalue="00"/>
      <field name="ip.dsfield.ecn" showname=".... ..00 = Explicit Congestion Notification: Not-ECT (Not ECN-Capable Transport) (0x00)" size="1" pos="15" show="0x00" value="0" unmaskedvalue="00"/>
    </field>
    <field name="ip.len" showname="Total Length: 88" size="2" pos="16" show="88" value="0058"/>
    <field name="ip.id" showname="Identification: 0xbb98 (48024)" size="2" pos="18" show="0xbb98" value="bb98"/>
    <field name="ip.flags" showname="Flags: 0x02 (Don&apos;t Fragment)" size="1" pos="20" show="0x02" value="40">
      <field name="ip.flags.rb" showname="0... .... = Reserved bit: Not set" size="1" pos="20" show="0" value="40"/>
      <field name="ip.flags.df" showname=".1.. .... = Don&apos;t fragment: Set" size="1" pos="20" show="1" value="40"/>
      <field name="ip.flags.mf" showname="..0. .... = More fragments: Not set" size="1" pos="20" show="0" value="40"/>
    </field>
    <field name="ip.frag_offset" showname="Fragment offset: 0" size="2" pos="20" show="0" value="4000"/>
    <field name="ip.ttl" showname="Time to live: 64" size="1" pos="22" show="64" value="40"/>
    <field name="ip.proto" showname="Protocol: TCP (6)" size="1" pos="23" show="6" value="06"/>
    <field name="ip.checksum" showname="Header checksum: 0x8105 [correct]" size="2" pos="24" show="0x8105" value="8105">
      <field name="ip.checksum_good" showname="Good: True" size="2" pos="24" show="1" value="8105"/>
      <field name="ip.checksum_bad" showname="Bad: False" size="2" pos="24" show="0" value="8105"/>
    </field>
    <field name="ip.src" showname="Source: 127.0.0.1 (127.0.0.1)" size="4" pos="26" show="127.0.0.1" value="7f000001"/>
    <field name="ip.addr" showname="Source or Destination Address: 127.0.0.1 (127.0.0.1)" hide="yes" size="4" pos="26" show="127.0.0.1" value="7f000001"/>
    <field name="ip.src_host" showname="Source Host: 127.0.0.1" hide="yes" size="4" pos="26" show="127.0.0.1" value="7f000001"/>
    <field name="ip.host" showname="Source or Destination Host: 127.0.0.1" hide="yes" size="4" pos="26" show="127.0.0.1" value="7f000001"/>
    <field name="ip.dst" showname="Destination: 127.0.0.1 (127.0.0.1)" size="4" pos="30" show="127.0.0.1" value="7f000001"/>
    <field name="ip.addr" showname="Source or Destination Address: 127.0.0.1 (127.0.0.1)" hide="yes" size="4" pos="30" show="127.0.0.1" value="7f000001"/>
    <field name="ip.dst_host" showname="Destination Host: 127.0.0.1" hide="yes" size="4" pos="30" show="127.0.0.1" value="7f000001"/>
    <field name="ip.host" showname="Source or Destination Host: 127.0.0.1" hide="yes" size="4" pos="30" show="127.0.0.1" value="7f000001"/>
    <field name="" show="Source GeoIP: Unknown" size="4" pos="26" value="7f000001"/>
    <field name="" show="Destination GeoIP: Unknown" size="4" pos="30" value="7f000001"/>
  </proto>
  <proto name="tcp" showname="Transmission Control Protocol, Src Port: 16509 (16509), Dst Port: 48144 (48144), Seq: 1, Ack: 29, Len: 36" size="32" pos="34">
    <field name="tcp.srcport" showname="Source port: 16509 (16509)" size="2" pos="34" show="16509" value="407d"/>
    <field name="tcp.dstport" showname="Destination port: 48144 (48144)" size="2" pos="36" show="48144" value="bc10"/>
    <field name="tcp.port" showname="Source or Destination Port: 16509" hide="yes" size="2" pos="34" show="16509" value="407d"/>
    <field name="tcp.port" showname="Source or Destination Port: 48144" hide="yes" size="2" pos="36" show="48144" value="bc10"/>
    <field name="tcp.stream" showname="Stream index: 0" size="0" pos="34" show="0"/>
    <field name="tcp.len" showname="TCP Segment Len: 36" hide="yes" size="1" pos="46" show="36" value="80"/>
    <field name="tcp.seq" showname="Sequence number: 1    (relative sequence number)" size="4" pos="38" show="1" value="8047d278"/>
    <field name="tcp.nxtseq" showname="Next sequence number: 37    (relative sequence number)" size="0" pos="34" show="37"/>
    <field name="tcp.ack" showname="Acknowledgment number: 29    (relative ack number)" size="4" pos="42" show="29" value="9d57d3a4"/>
    <field name="tcp.hdr_len" showname="Header length: 32 bytes" size="1" pos="46" show="32" value="80"/>
    <field name="tcp.flags" showname="Flags: 0x018 (PSH, ACK)" size="2" pos="46" show="0x0018" value="18" unmaskedvalue="8018">
      <field name="tcp.flags.res" showname="000. .... .... = Reserved: Not set" size="1" pos="46" show="0" value="0" unmaskedvalue="80"/>
      <field name="tcp.flags.ns" showname="...0 .... .... = Nonce: Not set" size="1" pos="46" show="0" value="0" unmaskedvalue="80"/>
      <field name="tcp.flags.cwr" showname=".... 0... .... = Congestion Window Reduced (CWR): Not set" size="1" pos="47" show="0" value="0" unmaskedvalue="18"/>
      <field name="tcp.flags.ecn" showname=".... .0.. .... = ECN-Echo: Not set" size="1" pos="47" show="0" value="0" unmaskedvalue="18"/>
      <field name="tcp.flags.urg" showname=".... ..0. .... = Urgent: Not set" size="1" pos="47" show="0" value="0" unmaskedvalue="18"/>
      <field name="tcp.flags.ack" showname=".... ...1 .... = Acknowledgment: Set" size="1" pos="47" show="1" value="1" unmaskedvalue="18"/>
      <field name="tcp.flags.push" showname=".... .... 1... = Push: Set" size="1" pos="47" show="1" value="1" unmaskedvalue="18"/>
      <field name="tcp.flags.reset" showname=".... .... .0.. = Reset: Not set" size="1" pos="47" show="0" value="0" unmaskedvalue="18"/>
      <field name="tcp.flags.syn" showname=".... .... ..0. = Syn: Not set" size="1" pos="47" show="0" value="0" unmaskedvalue="18"/>
      <field name="tcp.flags.fin" showname=".... .... ...0 = Fin: Not set" size="1" pos="47" show="0" value="0" unmaskedvalue="18"/>
    </field>
    <field name="tcp.window_size_value" showname="Window size value: 342" size="2" pos="48" show="342" value="0156"/>
    <field name="tcp.window_size" showname="Calculated window size: 43776" size="2" pos="48" show="43776" value="0156"/>
    <field name="tcp.window_size_scalefactor" showname="Window size scaling factor: 128" size="2" pos="48" show="128" value="0156"/>
    <field name="tcp.checksum" showname="Checksum: 0xfe4c [validation disabled]" size="2" pos="50" show="0xfe4c" value="fe4c">
      <field name="tcp.checksum_good" showname="Good Checksum: False" size="2" pos="50" show="0" value="fe4c"/>
      <field name="tcp.checksum_bad" showname="Bad Checksum: False" size="2" pos="50" show="0" value="fe4c"/>
    </field>
    <field name="tcp.options" showname="Options: (12 bytes), No-Operation (NOP), No-Operation (NOP), Timestamps" size="12" pos="54" show="01:01:08:0a:07:44:69:f4:07:44:69:ef" value="0101080a074469f4074469ef">
      <field name="" show="No-Operation (NOP)" size="1" pos="54" value="01">
        <field name="ip.opt.type" showname="Type: 1" size="1" pos="54" show="1" value="01">
          <field name="ip.opt.type.copy" showname="0... .... = Copy on fragmentation: No" size="1" pos="54" show="0" value="0" unmaskedvalue="01"/>
          <field name="ip.opt.type.class" showname=".00. .... = Class: Control (0)" size="1" pos="54" show="0" value="0" unmaskedvalue="01"/>
          <field name="ip.opt.type.number" showname="...0 0001 = Number: No-Operation (NOP) (1)" size="1" pos="54" show="1" value="1" unmaskedvalue="01"/>
        </field>
      </field>
      <field name="" show="No-Operation (NOP)" size="1" pos="55" value="01">
        <field name="ip.opt.type" showname="Type: 1" size="1" pos="55" show="1" value="01">
          <field name="ip.opt.type.copy" showname="0... .... = Copy on fragmentation: No" size="1" pos="55" show="0" value="0" unmaskedvalue="01"/>
          <field name="ip.opt.type.class" showname=".00. .... = Class: Control (0)" size="1" pos="55" show="0" value="0" unmaskedvalue="01"/>
          <field name="ip.opt.type.number" showname="...0 0001 = Number: No-Operation (NOP) (1)" size="1" pos="55" show="1" value="1" unmaskedvalue="01"/>
        </field>
      </field>
      <field name="" show="Timestamps: TSval 121924084, TSecr 121924079" size="10" pos="56" value="080a074469f4074469ef">
        <field name="tcp.option_kind" showname="Kind: Timestamp (8)" size="1" pos="56" show="8" value="08"/>
        <field name="tcp.option_len" showname="Length: 10" size="1" pos="57" show="10" value="0a"/>
        <field name="tcp.options.timestamp.tsval" showname="Timestamp value: 121924084" size="4" pos="58" show="121924084" value="074469f4"/>
        <field name="tcp.options.timestamp.tsecr" showname="Timestamp echo reply: 121924079" size="4" pos="62" show="121924079" value="074469ef"/>
      </field>
    </field>
    <field name="tcp.analysis" showname="SEQ/ACK analysis" size="0" pos="34" show="" value="">
      <field name="tcp.analysis.bytes_in_flight" showname="Bytes in flight: 36" size="0" pos="34" show="36"/>
    </field>
    <field name="tcp.pdu.size" showname="PDU Size: 36" size="36" pos="66" show="36" value="000000242000808600000001000000420000000100000000000000000000000100000000"/>
  </proto>
  <proto name="libvirt" showname="Libvirt" size="36" pos="66">
    <field name="libvirt.length" showname="length: 36" size="4" pos="66" show="36" value="00000024"/>
    <field name="libvirt.program" showname="program: REMOTE (0x20008086)" size="4" pos="70" show="0x20008086" value="20008086"/>
    <field name="libvirt.version" showname="version: 1" size="4" pos="74" show="1" value="00000001"/>
    <field name="libvirt.procedure" showname="procedure: AUTH_LIST (66)" size="4" pos="78" show="66" value="00000042"/>
    <field name="libvirt.type" showname="type: REPLY (1)" size="4" pos="82" show="1" value="00000001"/>
    <field name="libvirt.serial" showname="serial: 0" size="4" pos="86" show="0" value="00000000"/>
    <field name="libvirt.status" showname="status: OK (0)" size="4" pos="90" show="0" value="00000000"/>
  </proto>
</packet>


<packet>
  <proto name="geninfo" pos="0" showname="General information" size="122">
    <field name="num" pos="0" show="8" showname="Number" value="8" size="122"/>
    <field name="len" pos="0" show="122" showname="Frame Length" value="7a" size="122"/>
    <field name="caplen" pos="0" show="122" showname="Captured Length" value="7a" size="122"/>
    <field name="timestamp" pos="0" show="Jun 17, 2013 21:35:54.853718000 JST" showname="Captured Time" value="1371472554.853718000" size="122"/>
  </proto>
  <proto name="frame" showname="Frame 8: 122 bytes on wire (976 bits), 122 bytes captured (976 bits) on interface 0" size="122" pos="0">
    <field name="frame.interface_id" showname="Interface id: 0" size="0" pos="0" show="0"/>
    <field name="frame.encap_type" showname="Encapsulation type: Ethernet (1)" size="0" pos="0" show="1"/>
    <field name="frame.time" showname="Arrival Time: Jun 17, 2013 21:35:54.853718000 JST" size="0" pos="0" show="Jun 17, 2013 21:35:54.853718000"/>
    <field name="frame.offset_shift" showname="Time shift for this packet: 0.000000000 seconds" size="0" pos="0" show="0.000000000"/>
    <field name="frame.time_epoch" showname="Epoch Time: 1371472554.853718000 seconds" size="0" pos="0" show="1371472554.853718000"/>
    <field name="frame.time_delta" showname="Time delta from previous captured frame: 0.000146000 seconds" size="0" pos="0" show="0.000146000"/>
    <field name="frame.time_delta_displayed" showname="Time delta from previous displayed frame: 0.000154000 seconds" size="0" pos="0" show="0.000154000"/>
    <field name="frame.time_relative" showname="Time since reference or first frame: 0.005136000 seconds" size="0" pos="0" show="0.005136000"/>
    <field name="frame.number" showname="Frame Number: 8" size="0" pos="0" show="8"/>
    <field name="frame.len" showname="Frame Length: 122 bytes (976 bits)" size="0" pos="0" show="122"/>
    <field name="frame.cap_len" showname="Capture Length: 122 bytes (976 bits)" size="0" pos="0" show="122"/>
    <field name="frame.marked" showname="Frame is marked: False" size="0" pos="0" show="0"/>
    <field name="frame.ignored" showname="Frame is ignored: False" size="0" pos="0" show="0"/>
    <field name="frame.protocols" showname="Protocols in frame: eth:ip:tcp:libvirt" size="0" pos="0" show="eth:ip:tcp:libvirt"/>
  </proto>
  <proto name="eth" showname="Ethernet II, Src: 00:00:00_00:00:00 (00:00:00:00:00:00), Dst: 00:00:00_00:00:00 (00:00:00:00:00:00)" size="14" pos="0">
    <field name="eth.dst" showname="Destination: 00:00:00_00:00:00 (00:00:00:00:00:00)" size="6" pos="0" show="00:00:00:00:00:00" value="000000000000">
      <field name="eth.addr" showname="Address: 00:00:00_00:00:00 (00:00:00:00:00:00)" size="6" pos="0" show="00:00:00:00:00:00" value="000000000000"/>
      <field name="eth.lg" showname=".... ..0. .... .... .... .... = LG bit: Globally unique address (factory default)" size="3" pos="0" show="0" value="0" unmaskedvalue="000000"/>
      <field name="eth.ig" showname=".... ...0 .... .... .... .... = IG bit: Individual address (unicast)" size="3" pos="0" show="0" value="0" unmaskedvalue="000000"/>
    </field>
    <field name="eth.src" showname="Source: 00:00:00_00:00:00 (00:00:00:00:00:00)" size="6" pos="6" show="00:00:00:00:00:00" value="000000000000">
      <field name="eth.addr" showname="Address: 00:00:00_00:00:00 (00:00:00:00:00:00)" size="6" pos="6" show="00:00:00:00:00:00" value="000000000000"/>
      <field name="eth.lg" showname=".... ..0. .... .... .... .... = LG bit: Globally unique address (factory default)" size="3" pos="6" show="0" value="0" unmaskedvalue="000000"/>
      <field name="eth.ig" showname=".... ...0 .... .... .... .... = IG bit: Individual address (unicast)" size="3" pos="6" show="0" value="0" unmaskedvalue="000000"/>
    </field>
    <field name="eth.type" showname="Type: IP (0x0800)" size="2" pos="12" show="0x0800" value="0800"/>
  </proto>
  <proto name="ip" showname="Internet Protocol Version 4, Src: 127.0.0.1 (127.0.0.1), Dst: 127.0.0.1 (127.0.0.1)" size="20" pos="14">
    <field name="ip.version" showname="Version: 4" size="1" pos="14" show="4" value="45"/>
    <field name="ip.hdr_len" showname="Header length: 20 bytes" size="1" pos="14" show="20" value="45"/>
    <field name="ip.dsfield" showname="Differentiated Services Field: 0x00 (DSCP 0x00: Default; ECN: 0x00: Not-ECT (Not ECN-Capable Transport))" size="1" pos="15" show="0" value="00">
      <field name="ip.dsfield.dscp" showname="0000 00.. = Differentiated Services Codepoint: Default (0x00)" size="1" pos="15" show="0x00" value="0" unmaskedvalue="00"/>
      <field name="ip.dsfield.ecn" showname=".... ..00 = Explicit Congestion Notification: Not-ECT (Not ECN-Capable Transport) (0x00)" size="1" pos="15" show="0x00" value="0" unmaskedvalue="00"/>
    </field>
    <field name="ip.len" showname="Total Length: 108" size="2" pos="16" show="108" value="006c"/>
    <field name="ip.id" showname="Identification: 0xba6c (47724)" size="2" pos="18" show="0xba6c" value="ba6c"/>
    <field name="ip.flags" showname="Flags: 0x02 (Don&apos;t Fragment)" size="1" pos="20" show="0x02" value="40">
      <field name="ip.flags.rb" showname="0... .... = Reserved bit: Not set" size="1" pos="20" show="0" value="40"/>
      <field name="ip.flags.df" showname=".1.. .... = Don&apos;t fragment: Set" size="1" pos="20" show="1" value="40"/>
      <field name="ip.flags.mf" showname="..0. .... = More fragments: Not set" size="1" pos="20" show="0" value="40"/>
    </field>
    <field name="ip.frag_offset" showname="Fragment offset: 0" size="2" pos="20" show="0" value="4000"/>
    <field name="ip.ttl" showname="Time to live: 64" size="1" pos="22" show="64" value="40"/>
    <field name="ip.proto" showname="Protocol: TCP (6)" size="1" pos="23" show="6" value="06"/>
    <field name="ip.checksum" showname="Header checksum: 0x821d [correct]" size="2" pos="24" show="0x821d" value="821d">
      <field name="ip.checksum_good" showname="Good: True" size="2" pos="24" show="1" value="821d"/>
      <field name="ip.checksum_bad" showname="Bad: False" size="2" pos="24" show="0" value="821d"/>
    </field>
    <field name="ip.src" showname="Source: 127.0.0.1 (127.0.0.1)" size="4" pos="26" show="127.0.0.1" value="7f000001"/>
    <field name="ip.addr" showname="Source or Destination Address: 127.0.0.1 (127.0.0.1)" hide="yes" size="4" pos="26" show="127.0.0.1" value="7f000001"/>
    <field name="ip.src_host" showname="Source Host: 127.0.0.1" hide="yes" size="4" pos="26" show="127.0.0.1" value="7f000001"/>
    <field name="ip.host" showname="Source or Destination Host: 127.0.0.1" hide="yes" size="4" pos="26" show="127.0.0.1" value="7f000001"/>
    <field name="ip.dst" showname="Destination: 127.0.0.1 (127.0.0.1)" size="4" pos="30" show="127.0.0.1" value="7f000001"/>
    <field name="ip.addr" showname="Source or Destination Address: 127.0.0.1 (127.0.0.1)" hide="yes" size="4" pos="30" show="127.0.0.1" value="7f000001"/>
    <field name="ip.dst_host" showname="Destination Host: 127.0.0.1" hide="yes" size="4" pos="30" show="127.0.0.1" value="7f000001"/>
    <field name="ip.host" showname="Source or Destination Host: 127.0.0.1" hide="yes" size="4" pos="30" show="127.0.0.1" value="7f000001"/>
    <field name="" show="Source GeoIP: Unknown" size="4" pos="26" value="7f000001"/>
    <field name="" show="Destination GeoIP: Unknown" size="4" pos="30" value="7f000001"/>
  </proto>
  <proto name="tcp" showname="Transmission Control Protocol, Src Port: 48144 (48144), Dst Port: 16509 (16509), Seq: 29, Ack: 37, Len: 56" size="32" pos="34">
    <field name="tcp.srcport" showname="Source port: 48144 (48144)" size="2" pos="34" show="48144" value="bc10"/>
    <field name="tcp.dstport" showname="Destination port: 16509 (16509)" size="2" pos="36" show="16509" value="407d"/>
    <field name="tcp.port" showname="Source or Destination Port: 48144" hide="yes" size="2" pos="34" show="48144" value="bc10"/>
    <field name="tcp.port" showname="Source or Destination Port: 16509" hide="yes" size="2" pos="36" show="16509" value="407d"/>
    <field name="tcp.stream" showname="Stream index: 0" size="0" pos="34" show="0"/>
    <field name="tcp.len" showname="TCP Segment Len: 56" hide="yes" size="1" pos="46" show="56" value="80"/>
    <field name="tcp.seq" showname="Sequence number: 29    (relative sequence number)" size="4" pos="38" show="29" value="9d57d3a4"/>
    <field name="tcp.nxtseq" showname="Next sequence number: 85    (relative sequence number)" size="0" pos="34" show="85"/>
    <field name="tcp.ack" showname="Acknowledgment number: 37    (relative ack number)" size="4" pos="42" show="37" value="8047d29c"/>
    <field name="tcp.hdr_len" showname="Header length: 32 bytes" size="1" pos="46" show="32" value="80"/>
    <field name="tcp.flags" showname="Flags: 0x018 (PSH, ACK)" size="2" pos="46" show="0x0018" value="18" unmaskedvalue="8018">
      <field name="tcp.flags.res" showname="000. .... .... = Reserved: Not set" size="1" pos="46" show="0" value="0" unmaskedvalue="80"/>
      <field name="tcp.flags.ns" showname="...0 .... .... = Nonce: Not set" size="1" pos="46" show="0" value="0" unmaskedvalue="80"/>
      <field name="tcp.flags.cwr" showname=".... 0... .... = Congestion Window Reduced (CWR): Not set" size="1" pos="47" show="0" value="0" unmaskedvalue="18"/>
      <field name="tcp.flags.ecn" showname=".... .0.. .... = ECN-Echo: Not set" size="1" pos="47" show="0" value="0" unmaskedvalue="18"/>
      <field name="tcp.flags.urg" showname=".... ..0. .... = Urgent: Not set" size="1" pos="47" show="0" value="0" unmaskedvalue="18"/>
      <field name="tcp.flags.ack" showname=".... ...1 .... = Acknowledgment: Set" size="1" pos="47" show="1" value="1" unmaskedvalue="18"/>
      <field name="tcp.flags.push" showname=".... .... 1... = Push: Set" size="1" pos="47" show="1" value="1" unmaskedvalue="18"/>
      <field name="tcp.flags.reset" showname=".... .... .0.. = Reset: Not set" size="1" pos="47" show="0" value="0" unmaskedvalue="18"/>
      <field name="tcp.flags.syn" showname=".... .... ..0. = Syn: Not set" size="1" pos="47" show="0" value="0" unmaskedvalue="18"/>
      <field name="tcp.flags.fin" showname=".... .... ...0 = Fin: Not set" size="1" pos="47" show="0" value="0" unmaskedvalue="18"/>
    </field>
    <field name="tcp.window_size_value" showname="Window size value: 342" size="2" pos="48" show="342" value="0156"/>
    <field name="tcp.window_size" showname="Calculated window size: 43776" size="2" pos="48" show="43776" value="0156"/>
    <field name="tcp.window_size_scalefactor" showname="Window size scaling factor: 128" size="2" pos="48" show="128" value="0156"/>
    <field name="tcp.checksum" showname="Checksum: 0xfe60 [validation disabled]" size="2" pos="50" show="0xfe60" value="fe60">
